{
  "$schema": "https://json-schema.org/draft/2020-12/schema",
  "title": "Harness local state",
  "type": "object",
  "additionalProperties": false,
  "required": ["schemaVersion", "scope", "targets", "projectionMode"],
  "properties": {
    "schemaVersion": { "type": "integer", "const": 1 },
    "scope": { "type": "string", "enum": ["workspace", "user-global", "both"] },
    "projectionMode": { "type": "string", "enum": ["link", "portable"] },
    "hookMode": { "type": "string", "enum": ["off", "on"] },
    "deploymentProfile": { "type": "string", "enum": ["standard", "github-cloud"] },
    "policyProfile": { "type": "string" },
    "workspacePolicyOverlay": { "type": ["string", "null"] },
    "skillProfile": { "type": "string" },
    "targets": {
      "type": "object",
      "propertyNames": {
        "enum": ["codex", "copilot", "cursor", "claude-code"]
      },
      "additionalProperties": {
        "type": "object",
        "additionalProperties": false,
        "required": ["enabled", "paths"],
        "properties": {
          "enabled": { "type": "boolean" },
          "paths": {
            "type": "array",
            "items": { "type": "string" }
          }
        }
      }
    },
    "upstream": { "type": "object" },
    "lastSync": { "type": "string" },
    "lastFetch": { "type": "string" },
    "lastUpdate": { "type": "string" }
  }
}
