{
  "schemaVersion": 1,
  "scope": "both",
  "projectionMode": "portable",
  "targets": {
    "codex": {
      "enabled": true,
      "paths": [
        "/Users/jared/HarnessTemplate/AGENTS.md",
        "/Users/jared/.codex/AGENTS.md"
      ]
    },
    "copilot": {
      "enabled": true,
      "paths": [
        "/Users/jared/HarnessTemplate/.copilot/copilot-instructions.md",
        "/Users/jared/.copilot/copilot-instructions.md"
      ]
    }
  },
  "upstream": {}
}
